{
  "name": "wavs/rhythm ADPCM-A (YM2610/OPNB)",
  "codec": "adpcm-a",
  "boundary": 256,
  "bin_file": "wavs_opnb_adpcma.bin",
  "adpcm_json": "wavs_opnb_adpcma.json",
  "swpatches": [
    { "entry_no": 0, "sw_bank": 0, "sw_prog": 2 },
    { "entry_no": 1, "sw_bank": 0, "sw_prog": 2 },
    { "entry_no": 2, "sw_bank": 0, "sw_prog": 2 },
    { "entry_no": 3, "sw_bank": 0, "sw_prog": 2 },
    { "entry_no": 4, "sw_bank": 0, "sw_prog": 2 },
    { "entry_no": 5, "sw_bank": 0, "sw_prog": 2 },
    { "entry_no": 6, "sw_bank": 0, "sw_prog": 2 },
    { "entry_no": 7, "sw_bank": 0, "sw_prog": 2 },
    { "entry_no": 8, "sw_bank": 0, "sw_prog": 2 },
    { "entry_no": 9, "sw_bank": 0, "sw_prog": 2 },
    { "entry_no": 10, "sw_bank": 0, "sw_prog": 2 },
    { "entry_no": 11, "sw_bank": 0, "sw_prog": 2 },
    { "entry_no": 12, "sw_bank": 0, "sw_prog": 2 },
    { "entry_no": 13, "sw_bank": 0, "sw_prog": 2 },
    { "entry_no": 14, "sw_bank": 0, "sw_prog": 2 },
    { "entry_no": 15, "sw_bank": 0, "sw_prog": 2 },
    { "entry_no": 16, "sw_bank": 0, "sw_prog": 2 },
    { "entry_no": 17, "sw_bank": 0, "sw_prog": 2 },
    { "entry_no": 18, "sw_bank": 0, "sw_prog": 2 },
    { "entry_no": 19, "sw_bank": 0, "sw_prog": 2 },
    { "entry_no": 20, "sw_bank": 0, "sw_prog": 2 },
    { "entry_no": 21, "sw_bank": 0, "sw_prog": 2 },
    { "entry_no": 22, "sw_bank": 0, "sw_prog": 2 },
    { "entry_no": 23, "sw_bank": 0, "sw_prog": 2 },
    { "entry_no": 24, "sw_bank": 0, "sw_prog": 2 },
    { "entry_no": 25, "sw_bank": 0, "sw_prog": 2 },
    { "entry_no": 26, "sw_bank": 0, "sw_prog": 2 },
    { "entry_no": 27, "sw_bank": 0, "sw_prog": 2 },
    { "entry_no": 28, "sw_bank": 0, "sw_prog": 2 },
    { "entry_no": 29, "sw_bank": 0, "sw_prog": 2 },
    { "entry_no": 30, "sw_bank": 0, "sw_prog": 2 },
    { "entry_no": 31, "sw_bank": 0, "sw_prog": 2 },
    { "entry_no": 32, "sw_bank": 0, "sw_prog": 2 },
    { "entry_no": 33, "sw_bank": 0, "sw_prog": 2 },
    { "entry_no": 34, "sw_bank": 0, "sw_prog": 2 },
    { "entry_no": 35, "sw_bank": 0, "sw_prog": 2 },
    { "entry_no": 36, "sw_bank": 0, "sw_prog": 2 },
    { "entry_no": 37, "sw_bank": 0, "sw_prog": 2 },
    { "entry_no": 38, "sw_bank": 0, "sw_prog": 2 },
    { "entry_no": 39, "sw_bank": 0, "sw_prog": 2 },
    { "entry_no": 40, "sw_bank": 0, "sw_prog": 2 },
    { "entry_no": 41, "sw_bank": 0, "sw_prog": 2 },
    { "entry_no": 42, "sw_bank": 0, "sw_prog": 2 },
    { "entry_no": 43, "sw_bank": 0, "sw_prog": 2 },
    { "entry_no": 44, "sw_bank": 0, "sw_prog": 2 },
    { "entry_no": 45, "sw_bank": 0, "sw_prog": 2 },
    { "entry_no": 46, "sw_bank": 0, "sw_prog": 2 },
    { "entry_no": 47, "sw_bank": 0, "sw_prog": 2 },
    { "entry_no": 48, "sw_bank": 0, "sw_prog": 2 },
    { "entry_no": 49, "sw_bank": 0, "sw_prog": 2 },
    { "entry_no": 50, "sw_bank": 0, "sw_prog": 2 },
    { "entry_no": 51, "sw_bank": 0, "sw_prog": 2 },
    { "entry_no": 52, "sw_bank": 0, "sw_prog": 2 },
    { "entry_no": 53, "sw_bank": 0, "sw_prog": 2 },
    { "entry_no": 54, "sw_bank": 0, "sw_prog": 2 },
    { "entry_no": 55, "sw_bank": 0, "sw_prog": 2 },
    { "entry_no": 56, "sw_bank": 0, "sw_prog": 2 },
    { "entry_no": 57, "sw_bank": 0, "sw_prog": 2 },
    { "entry_no": 58, "sw_bank": 0, "sw_prog": 2 },
    { "entry_no": 59, "sw_bank": 0, "sw_prog": 2 },
    { "entry_no": 60, "sw_bank": 0, "sw_prog": 2 },
    { "entry_no": 61, "sw_bank": 0, "sw_prog": 2 },
    { "entry_no": 62, "sw_bank": 0, "sw_prog": 2 },
    { "entry_no": 63, "sw_bank": 0, "sw_prog": 2 },
    { "entry_no": 64, "sw_bank": 0, "sw_prog": 2 },
    { "entry_no": 65, "sw_bank": 0, "sw_prog": 2 },
    { "entry_no": 66, "sw_bank": 0, "sw_prog": 2 },
    { "entry_no": 67, "sw_bank": 0, "sw_prog": 2 },
    { "entry_no": 68, "sw_bank": 0, "sw_prog": 2 },
    { "entry_no": 69, "sw_bank": 0, "sw_prog": 2 },
    { "entry_no": 70, "sw_bank": 0, "sw_prog": 2 },
    { "entry_no": 71, "sw_bank": 0, "sw_prog": 2 },
    { "entry_no": 72, "sw_bank": 0, "sw_prog": 2 },
    { "entry_no": 73, "sw_bank": 0, "sw_prog": 2 },
    { "entry_no": 74, "sw_bank": 0, "sw_prog": 2 },
    { "entry_no": 75, "sw_bank": 0, "sw_prog": 2 },
    { "entry_no": 76, "sw_bank": 0, "sw_prog": 2 },
    { "entry_no": 77, "sw_bank": 0, "sw_prog": 2 },
    { "entry_no": 78, "sw_bank": 0, "sw_prog": 2 },
    { "entry_no": 79, "sw_bank": 0, "sw_prog": 2 },
    { "entry_no": 80, "sw_bank": 0, "sw_prog": 2 },
    { "entry_no": 81, "sw_bank": 0, "sw_prog": 2 },
    { "entry_no": 82, "sw_bank": 0, "sw_prog": 2 },
    { "entry_no": 83, "sw_bank": 0, "sw_prog": 2 },
    { "entry_no": 84, "sw_bank": 0, "sw_prog": 2 },
    { "entry_no": 85, "sw_bank": 0, "sw_prog": 2 },
    { "entry_no": 86, "sw_bank": 0, "sw_prog": 2 },
    { "entry_no": 87, "sw_bank": 0, "sw_prog": 2 },
    { "entry_no": 88, "sw_bank": 0, "sw_prog": 2 },
    { "entry_no": 89, "sw_bank": 0, "sw_prog": 2 },
    { "entry_no": 90, "sw_bank": 0, "sw_prog": 2 },
    { "entry_no": 91, "sw_bank": 0, "sw_prog": 2 },
    { "entry_no": 92, "sw_bank": 0, "sw_prog": 2 },
    { "entry_no": 93, "sw_bank": 0, "sw_prog": 2 },
    { "entry_no": 94, "sw_bank": 0, "sw_prog": 2 },
    { "entry_no": 95, "sw_bank": 0, "sw_prog": 2 },
    { "entry_no": 96, "sw_bank": 0, "sw_prog": 2 },
    { "entry_no": 97, "sw_bank": 0, "sw_prog": 2 },
    { "entry_no": 98, "sw_bank": 0, "sw_prog": 2 },
    { "entry_no": 99, "sw_bank": 0, "sw_prog": 2 },
    { "entry_no": 100, "sw_bank": 0, "sw_prog": 2 },
    { "entry_no": 101, "sw_bank": 0, "sw_prog": 2 },
    { "entry_no": 102, "sw_bank": 0, "sw_prog": 2 },
    { "entry_no": 103, "sw_bank": 0, "sw_prog": 2 },
    { "entry_no": 104, "sw_bank": 0, "sw_prog": 2 },
    { "entry_no": 105, "sw_bank": 0, "sw_prog": 2 },
    { "entry_no": 106, "sw_bank": 0, "sw_prog": 2 },
    { "entry_no": 107, "sw_bank": 0, "sw_prog": 2 },
    { "entry_no": 108, "sw_bank": 0, "sw_prog": 2 },
    { "entry_no": 109, "sw_bank": 0, "sw_prog": 2 },
    { "entry_no": 110, "sw_bank": 0, "sw_prog": 2 },
    { "entry_no": 111, "sw_bank": 0, "sw_prog": 2 },
    { "entry_no": 112, "sw_bank": 0, "sw_prog": 2 },
    { "entry_no": 113, "sw_bank": 0, "sw_prog": 2 },
    { "entry_no": 114, "sw_bank": 0, "sw_prog": 2 },
    { "entry_no": 115, "sw_bank": 0, "sw_prog": 2 },
    { "entry_no": 116, "sw_bank": 0, "sw_prog": 2 },
    { "entry_no": 117, "sw_bank": 0, "sw_prog": 2 },
    { "entry_no": 118, "sw_bank": 0, "sw_prog": 2 },
    { "entry_no": 119, "sw_bank": 0, "sw_prog": 2 },
    { "entry_no": 120, "sw_bank": 0, "sw_prog": 2 }
  ]
}
