{
  "name": "wavs/rhythm ADPCM (SSGS: PSS-680/RX11/RX21L)",
  "codec": "ssgs",
  "sample_rate": 32000,
  "boundary": 32,
  "bin_file": "wavs_ssgs_adpcm.bin",
  "adpcm_json": "wavs_ssgs_adpcm.json",
  "swpatches": [
    { "entry_no": 0, "sw_bank": 0, "sw_prog": 2 },
    { "entry_no": 1, "sw_bank": 0, "sw_prog": 2 },
    { "entry_no": 2, "sw_bank": 0, "sw_prog": 2 },
    { "entry_no": 3, "sw_bank": 0, "sw_prog": 2 },
    { "entry_no": 4, "sw_bank": 0, "sw_prog": 2 },
    { "entry_no": 5, "sw_bank": 0, "sw_prog": 2 },
    { "entry_no": 6, "sw_bank": 0, "sw_prog": 2 },
    { "entry_no": 7, "sw_bank": 0, "sw_prog": 2 },
    { "entry_no": 8, "sw_bank": 0, "sw_prog": 2 },
    { "entry_no": 9, "sw_bank": 0, "sw_prog": 2 },
    { "entry_no": 10, "sw_bank": 0, "sw_prog": 2 },
    { "entry_no": 11, "sw_bank": 0, "sw_prog": 2 },
    { "entry_no": 12, "sw_bank": 0, "sw_prog": 2 },
    { "entry_no": 13, "sw_bank": 0, "sw_prog": 2 },
    { "entry_no": 14, "sw_bank": 0, "sw_prog": 2 },
    { "entry_no": 15, "sw_bank": 0, "sw_prog": 2 },
    { "entry_no": 16, "sw_bank": 0, "sw_prog": 2 },
    { "entry_no": 17, "sw_bank": 0, "sw_prog": 2 },
    { "entry_no": 18, "sw_bank": 0, "sw_prog": 2 },
    { "entry_no": 19, "sw_bank": 0, "sw_prog": 2 },
    { "entry_no": 20, "sw_bank": 0, "sw_prog": 2 },
    { "entry_no": 21, "sw_bank": 0, "sw_prog": 2 },
    { "entry_no": 22, "sw_bank": 0, "sw_prog": 2 },
    { "entry_no": 23, "sw_bank": 0, "sw_prog": 2 },
    { "entry_no": 24, "sw_bank": 0, "sw_prog": 2 },
    { "entry_no": 25, "sw_bank": 0, "sw_prog": 2 },
    { "entry_no": 26, "sw_bank": 0, "sw_prog": 2 },
    { "entry_no": 27, "sw_bank": 0, "sw_prog": 2 },
    { "entry_no": 28, "sw_bank": 0, "sw_prog": 2 },
    { "entry_no": 29, "sw_bank": 0, "sw_prog": 2 },
    { "entry_no": 30, "sw_bank": 0, "sw_prog": 2 },
    { "entry_no": 31, "sw_bank": 0, "sw_prog": 2 },
    { "entry_no": 32, "sw_bank": 0, "sw_prog": 2 },
    { "entry_no": 33, "sw_bank": 0, "sw_prog": 2 },
    { "entry_no": 34, "sw_bank": 0, "sw_prog": 2 },
    { "entry_no": 35, "sw_bank": 0, "sw_prog": 2 },
    { "entry_no": 36, "sw_bank": 0, "sw_prog": 2 },
    { "entry_no": 37, "sw_bank": 0, "sw_prog": 2 },
    { "entry_no": 38, "sw_bank": 0, "sw_prog": 2 },
    { "entry_no": 39, "sw_bank": 0, "sw_prog": 2 },
    { "entry_no": 40, "sw_bank": 0, "sw_prog": 2 },
    { "entry_no": 41, "sw_bank": 0, "sw_prog": 2 },
    { "entry_no": 42, "sw_bank": 0, "sw_prog": 2 },
    { "entry_no": 43, "sw_bank": 0, "sw_prog": 2 },
    { "entry_no": 44, "sw_bank": 0, "sw_prog": 2 },
    { "entry_no": 45, "sw_bank": 0, "sw_prog": 2 },
    { "entry_no": 46, "sw_bank": 0, "sw_prog": 2 },
    { "entry_no": 47, "sw_bank": 0, "sw_prog": 2 },
    { "entry_no": 48, "sw_bank": 0, "sw_prog": 2 },
    { "entry_no": 49, "sw_bank": 0, "sw_prog": 2 },
    { "entry_no": 50, "sw_bank": 0, "sw_prog": 2 },
    { "entry_no": 51, "sw_bank": 0, "sw_prog": 2 },
    { "entry_no": 52, "sw_bank": 0, "sw_prog": 2 },
    { "entry_no": 53, "sw_bank": 0, "sw_prog": 2 },
    { "entry_no": 54, "sw_bank": 0, "sw_prog": 2 },
    { "entry_no": 55, "sw_bank": 0, "sw_prog": 2 },
    { "entry_no": 56, "sw_bank": 0, "sw_prog": 2 },
    { "entry_no": 57, "sw_bank": 0, "sw_prog": 2 }
  ]
}
